category,prod_id,rating,polarity,review,review_len,review_id
Cell_Phones_and_Accessories,B001QFZKN0,1.0,negative,the elegant design metallic case quality display overall operability of the phones standard communications and convenience features and even an amazingly clear built-in speaker should please any user not inclined toward heavy text-messaging or web-surfing and all of this pleased me until my phone stopped working after 2 months instead of starting up it just began flashing a white screen for a few seconds got a replacement and 2 months later that phone died an identical death ordered a new replacement as this was mandatory given my mobile service agreement and in 2 more months I shall get back with you getting back with you phone just broke again same problem although this time it lasted an amazing 4 months worse news is t-mobile is forcing me to take a fourth one before i can upgrade to something that may actually endure for awhile my fifth replacement phone is on the way can not wait,152,0
Cell_Phones_and_Accessories,B001QFZKN0,1.0,negative,the sierra wireless card is flimsy and has defects there is some glitch that when it updates it is software it kills the wireless unit I have had 4 of these replaced now the biggest rip off of all is that sprint warehouse says it is does nt receive them back and sprint charges you 100 after 15 days this time i mailed it back with postal certification to prove it was received by them sprint customer service says they acknowledge there has a problem but they have to just send the information higher into their management chain i also had a sprint lotus phone widely known for being defective and yet sprint still sells them to this day sprint has ripped me off bottom line I am posting this as a warning to others avoid sprint,131,1
Cell_Phones_and_Accessories,B001QFZKN0,4.0,positive,i rather like this phone the internal screen is very impressive however the phones reception is not that good I have tested 2 different t-mobile phones in the same area and this phone has the worse reception the phone is very good-looking it does not look durable although the keys do not feel comfortable if you text a lot they are not very responsive so you can not type very fast,67,5
Cell_Phones_and_Accessories,B001QFZKN0,5.0,positive,so I am the type of person who really takes care before making a purchase such as a cell phone because i intend to own it until it is no longer workable however i bought this phone back in november on a bit of a whim because my old cell phone which endured for more than three years had finally broken to the point of no return and i love it it is modern easy to use five-fave compatible and offers a lot more space for storing pictures and music than my previous phone the camera takes nice pictures the sound is good if you are looking to hear a little music and your ipod is dead and there are really cool pre-set themes you can choose from my only contention is that the flip action is not especially smooth but I am used to the slider phone i had for three years before this happy cell phone hunting,154,15
Cell_Phones_and_Accessories,B001QFZKN0,2.0,negative,i have had mobile broadband through sprint for three years it was finally time to get a new modem and i chose this one i am sorry i did it gets no reception inside or outside of my house this little modem is getting sent back to sprint as soon as possible,49,11
Cell_Phones_and_Accessories,B001QFZKN0,5.0,positive,i do not know what the previous reviewers expectations are but the device will only work as well as the service connection for your area i live in an area where we had only dial up or satellite for internet available to us until this and let me tell you the blazing speeds i get with this comparatively make it well worth it to me in a rural area i think within about a mile of the tower i get consistently 2 mb coverage it works perfectly runs probably easily 12 hours / day and I have had it for 10 months the only time it has gone down everything in my area is down including landline and cell phones actually that happened a couple days before thanksgiving everything was down but my sierra wireless was still delivering dial up speed connection,142,14
Cell_Phones_and_Accessories,B001QFZKN0,5.0,positive,perfect product high quality can not go wrong with this product as i have used it for 2 years and have had no problems,21,8
Cell_Phones_and_Accessories,B001QFZKN0,4.0,positive,i have this card and it works ok the service where i am in tucson gives me about 40 to 60 percent i did buy a antennae from [ ] and it works awesome with this card it is a booster antenna w / cables for sierra aircard 598u i get 80 100 percent with the antenna plugged in,56,13
Cell_Phones_and_Accessories,B001TL0Z72,4.0,positive,phone is a very good a bit heavy but makes up for it is speed and keyboard very adaptable to large fingers very good buy maybe buy one for a friend,30,9
Cell_Phones_and_Accessories,B001TL0Z72,3.0,neutral,i read all of the reviews and even checked online to make sure this was a good phone it is not a smart phone it is the most stupid phone I have ever owned and i intend to return it as soon as possible it took 3 days of searching online to find out how to download ringtones to the phone that the phone will actually let me use nothing in the manual or the online manual tells you the hoops you have to jump thru if there had not been a blog I had have never figured it out this phone shuts off immeditately if i turn it on and accidentally turn my hand sideways while holding it it will not get at t service at my house even although my at t go phone gets a signal without a problem it will not hook to the 3 g network half the time i bought this phone new so it was not remanufactured do not waste your time or money,159,11
Cell_Phones_and_Accessories,B001TL0Z72,1.0,negative,i bought an htc tilt 2 when replacing a blackberry bold 9000 end of contract / changing to a new phone it was the flavor of choice and had a number of things i wanted i had it for three weeks of the time all the windows features worked fine did not have difficulty with freezes or other things that people reported i set up my email and it failed numerous times would not automatically send / receive without going thru hoops anything sent was visible for 1and anything received was also visible for 1there was no auto-delete function invoked i was on the phone with at t for 6 hrs over the course of the last two weeks they agreed there was a problem i took it into an at t store where their store management reproduced the problems down to the last one and said he agreed too lacking the email function this smart phone is not such a smart phone and not worth the box it came in i replaced it paying the difference in with a blackberry torch I have now had it 3 weeks the torch and have had zero problems and have not had a need to call tech support not even once one other thing that should be changed the keys and the backlighting make for difficult use of the keys unless the room is dim keyor backlightshould be changed good luck with your purchase or find something else,251,0
Cell_Phones_and_Accessories,B001TL0Z72,5.0,positive,wifi and navigation is supergood htc is a classic smartphone that greatly combines a real smart phone and a pc personalized it to my style and proud of my choice,30,13
Cell_Phones_and_Accessories,B001TL0Z72,5.0,positive,i had one just like this before someone robbed me so i know what i was buying yeah this is not an iphone or a new phone with android but with a few hints you can make of this old smartphone it was released in 2007 works pretty damm well i install the windows mobile 65 and the performance of the phone improves a lot much faster without freezes I have installed a cooked version of the phoenix iii with touchflo i have the newest opera mobile garmin xt foursquare youtube and the performance is quite well the battery life is acceptable using wifi or the 3 g networks 1 day fully charged I am from chile and the purchase and shipping were faster and without problems,124,5
Cell_Phones_and_Accessories,B001TL0Z72,2.0,negative,I have had and loved other htc phones this one does not live up to it is brand at all i bought two for my girls this past christmas and they have had nothing but problems despite being long time cell phone users part of the problem is the crappy windows software but even if that was not a pita the hardware is already falling apart and it is just mid-january the tilt feature broke the first week in one of them i bought extra batteries for them and it is a good thing because the battery life is almost non-existent also they are very bulky so if you want a fairly light or small phone this is not it,115,8
Cell_Phones_and_Accessories,B001TL0Z72,4.0,positive,as the title suggests i consider this smartphone to be a good work horse a previous poster listed a few features on this device I have expanded some of the detail on that and added some other info tether as a modem very helpful and less expensive than buying a standalone aircard full keyboard there is a soft keyboard you can type on without having to slide out the keyboard everytime you need to type something can open edit save microsoft office files word powerpointon an iphone you can only view not edit screen tilts helpful to reduce glare create ringtones on the fly by choosing a song and right clicking without additional cost helpful tips for windows mobile periodically windows mobile devices experience registry corruption the best resolution is to perform a hard reset on the device clearing out the memory and essentially freshly building the device by doing these periodic resets in my experience 2 times a year is necessary the device remains responsive and less buggy there is a lot of functionality built into the tilt that is handy it is one of the better windows devices for navigation using a bluetooth gps bug the device can do quite well guiding without the necessity of having to buy a singletasking handheld navigation system,226,2
Cell_Phones_and_Accessories,B001TL0Z72,5.0,positive,this is a really good device i have had many cellphones and pdas and this is one of the best ones i have ever had it is durable has good battery life and an easy to use qwerty keyboard the tilting action makes it easy to see what you are typing with no glare the video resolution is good and sd card makes it as expandable as you want you can switch out cards if you start running out of room or want to keep some files private i highly recommend this device i have used it in a busy medical practice loaded with references and resources and with the google mobile apps bar i am on the internet in a flash and can access the web or my google apps luckily it is pretty much drop proof,138,1
Cell_Phones_and_Accessories,B0021K4ISC,1.0,negative,this kit is terrible in a 2004 escalade the radio did not clear the bottom and sits about an 8th inch out,21,55
Cell_Phones_and_Accessories,B0021K4ISC,1.0,negative,just like any dash kit from walmart this is terrible quality breaking the tabs i needed to to make it fit the holes was very hard but breaking the ones i needed to keep by accident was all too easy i do not recommend this or sosche,46,40
Cell_Phones_and_Accessories,B0021K4ISC,2.0,negative,the side plates probably would have worked if the tabs i need had not broke while trying to cut off the tabs that are not needed as directed by the instructions one had no room around it for using a razor blade knife it was the last tab i had to do and a few needed tabs were very close to it that they ended up being broken off i am not sure how i could have been more careful,78,19
Cell_Phones_and_Accessories,B0021K4ISC,1.0,negative,extremely cheap i have installed many stereos and this broke within two days,13,31
Cell_Phones_and_Accessories,B0021K4ISC,1.0,negative,it does not work on 08 silverado it says 90 and up but only goes to early 07 model will not work on new body style,26,115
Cell_Phones_and_Accessories,B0021K4ISC,5.0,positive,fit the car dash and new stereo perfectly my son is very happy,13,56
Cell_Phones_and_Accessories,B0021K4ISC,5.0,positive,works great with double din touchscreen reciever in my 2005 silverado,11,69
Cell_Phones_and_Accessories,B0021K4ISC,4.0,positive,worked as described wish there was not as much cutting of tabs involved,13,105
Cell_Phones_and_Accessories,B002959MS0,2.0,negative,i was thrilled with theof a regular keyboard against touch keyboard on my iphone it is a more comfortable way to type for me the addition of the keyboard adds a little bulk to the phone but is very comfortable and lower profile than the one my friend has from a year ago the problem i have with this product is that i have only been using it for 6 weeks and already the markings on the keyboard have rubbed off so now i can not see the functions of many of the keys it does not matter much on the letters but the symbols are gone and i have to guess and hunt for the right ones now not acceptable wear,122,27
Cell_Phones_and_Accessories,B002959MS0,1.0,negative,thisis not worth the 60 dollars it costs i was hoping to have an easier time typing however with most of the applications it does not turn it also drains you battery i had to charge my phone 5 to 6 times a day very unhappy sending theback,52,40
Cell_Phones_and_Accessories,B002959MS0,2.0,negative,not worth it wanted my new iphone to work as my old htc evo shift but it did not to bulky and i do not like the full touch screen very much i i phone is not all that bad,38,26
Cell_Phones_and_Accessories,B002959MS0,3.0,neutral,if you are looking for a case with the slide out keyboard this is as good as it gets for now the case and keyboard are a bit bulky but they get the job done i find myself taking the case off when I am at work and only using it when at home,53,43
Cell_Phones_and_Accessories,B002959MS0,3.0,neutral,this case / keyboard works just fine everything functions well my only complaint is that it is difficult to hold / balance as the top where the phone is is so much heavier than where the keyboard is makes it uncomfortable to hold while typing functionality is fine i do not know how one would redesign this to fix this i have become accustomed to using siri so i do not have to type at all,71,24
Cell_Phones_and_Accessories,B002959MS0,4.0,positive,i love the case i got it yesterday and i there is nothing really about it that i do not like i just got to get used to where the keys are but the only flaw about it is my keyboard seems a little loose but besides that it is a great case and i would recomend it to everyone who wants a physical keyboard to use plus the backlite is very usefull in dark areas,73,37
Cell_Phones_and_Accessories,B002959MS0,5.0,positive,this keyboard was probably the best purchase for my iphone that I have ever made it worked wonderfully and the keyboard was just the right size for me i will say that if you have bigger fingers then this product might not be for you but it never wore out and i type a lot of texts messages during the day the backlighting worked great as well the only thing that was tricky was knowing when to plug the keyboard in to charge but it did last me about 2 - 3 days and that is with it constantly being on and used very impressed and happy with this product even although i do not have that phone anymore,114,12
Cell_Phones_and_Accessories,B002959MS0,4.0,positive,the virtual keyboard keys are a little to small for me and my smart phone makes me feel a little dumb you know always spelling a word before you can finish your sentence spell check is good and sometimes i need it but not with ever word the keyboard buddy allows me to text with ease it makes the phone a little thick i can live with that just what i needed,72,19
Cell_Phones_and_Accessories,B0029F2O3A,5.0,positive,great phone which has the comfort of a larger phone mixed with a very easy to use qwerty keyboard the keyboard has nice space and a texture that feels like the kindle with the touch of a button the qwerty turns into 1234 or ect just a need phone highly recommended,52,0
Cell_Phones_and_Accessories,B0029F2O3A,3.0,neutral,the messaging features are nice typing text messages is not so much of a hassle with the keyboard also the screen is quite pretty i have found the morphing keyboard to be a great feature when receiving calls the phone works over half the time but it sometimes resets when i attempt to answer calls also at other times it lights up when a call is coming in but will not actually finish the process and start ringing so i do not know who actually called until they tell me later I am beginning to kick myself for signing a contract for service with this phone and i suspect that it is going to be a pain in the butt until the contract is up,122,1
Cell_Phones_and_Accessories,B0029F2O3A,5.0,positive,this is a excellent phone great talk time excellent standby very user friendly i may state it takes a little time to get use to but so does it when you change to new anything the only down fall is the top 3 keys when your texting when you have large fingers besides that i would recommend this phone to anybody my wife and kids go through phones like water so had many phones but this one is very unique exspecially with the flip screen the pictures are excellent minus not having a flash i can live with that because in low light still takes excellent pics the flashes on all other phones are a joke those are only good for a couple of foot so take how you want but i recommend this phone for anybody men or women is is very unique only gripe is for my wife could be in different colors but my gripe is 3 top buttons could be different thanks for reading jeff,169,5
Cell_Phones_and_Accessories,B0029F2O3A,5.0,positive,i just got this phone a couple days ago and i am in love it works great texting is a breeze great size,23,15
Cell_Phones_and_Accessories,B0029F2O3A,4.0,positive,i have been using this phone for a few days now and i like it i am not a big gadget phone fan preferring a simpler device that does just what i want the voice quality is acceptable and after a short learning cycle is easy to use the alias 2 allows me a novice texter to send and receive text messages with no real hassles the keypad is a great size even for my larger fingers i would have given 5 stars except for the learning curve required to figure the phone out not that this is bad but it is definitely different than the older phones i was used to,112,11
Cell_Phones_and_Accessories,B0029F2O3A,1.0,negative,this is probably the wrost experience i had with amazon and it costed me 7200 both my phones from amazon arrived inright time but without activation i called at t and they could not locate our phone numbers so had to call back amazon and learned that they have not activated our phones amazon customer service took good amount of time to do this meanwhile i missed by billing cycle with old cell phone company this process took about a week and not to mention the sim card delivered was not working and amazon had to ship again,97,14
Cell_Phones_and_Accessories,B0029F2O3A,2.0,negative,overall i like the phone for it is call quality i love the keyboard and find it very easy to type text messages i have not used the camera or the bluetooth features i can access my email accounts easily the main problem with the phone is that locks up when i attempt to use the mp3 player i have an 8 gb microsd card with all of my music on it i hook the phone up to my car radio to play it everything was fine for the first month but now the phone locks up or freezes when it is in media mode and the only way to unlock it is to remove and then replace the battery very annoying the phone has also turned off several times when i was attempting to answer a call,134,8
Cell_Phones_and_Accessories,B0029F2O3A,2.0,negative,i loved my samsung alias as most alias owners do i decided to purchase the alias 2 on faith assuming that samsung had simply updated certain features of the original i was mistaken the first thing you will notice is the size the alias 2 is taller thicker and wider than the original if you are like me one of the reasons you bought the original alias was it is super-slim design i would say it is about 50 bulkier than the original while the original slid into your jeans and disappeared the new one will stick out like a sore thumb i suppose the increase in size supports the new and improved camera / camcorder but i never used that feature too much in the first place ultimately i would say this is the reason i returned the alias 2 but i also did not care for the much ballyhooed liquid ink screen when texting you must toggle through 3 screens to find all the numbers / symbols / punctuation marks that you need in fact the third screen only had a scant number of symbols on it so the empty space is frustrating when toggling to the first screen for the letters the empty space is a theme on all screens in fact in either orientation as i said i found this annoying maybe only because i became so used to the 1000 figures / symbols crammed onto the original alias phone pad i ended up returning the alias 2 and going back to the original i will keep my new every 2 discount until verizon comes out with a very good android or apple finally relents with the iphone / at t exclusivity,273,13
Cell_Phones_and_Accessories,B002D0ZN8Y,4.0,positive,when i first heard about this headset i thought wow they are really small i was looking for some external box to support the bluetooth but your seeing pretty much everything that is included in the package and pretty nice carrying case not shown all of the tech is stored in the ear buds and charging is done on one side of the ear plug a very small plug for ac adapter to plug in and charge the headset some reviews i had seen from other sites posted that the headset gets warm after extended use in my case it does not but i have not been using the headset beyond 3 hours of use the feeling in the ears is a little heavy then normal guys with larger canals will not notice much but those with smaller canals would find them a little uncomfortable one of the strange things about bluetooth and plugged ear phones of course is fidelity of the sound and when you wear these sony headset sealed in your ears you get some pretty decent sound not the typical high end fidelity you expect from most plugged ear sets i currently use the headset with my new iphone 3 g s and they work outstanding with a distance of about 20 feet from the iphone the audio for music and podcast is prefect for me the audio for the phone with the mic works perfectly with very little echoing on receivers end of course the biggest con in this review is the price I have managed to get the headset at about 149 but i think for the portability and flexibility for the bluetooth this is an excellent choice,280,0
Cell_Phones_and_Accessories,B002D0ZN8Y,5.0,positive,i wanted to buy a light and stereo bluetooth headset i saw a lot and i tried many from my friend before i choose this it is not very loud and do not painful to the ear but the make me sad is the box was not contain the cylinder carry case,57,5
Cell_Phones_and_Accessories,B002D0ZN8Y,1.0,negative,there is no control whatsoever with these headphones none i should not have to be some kind of techhie geek who knows all the ins and outs of avrcp software nor should i have to search and read through discussion boards to find out what should be basic info provided by the manufacturer sony should state explicitly that these headphones do not work with the iphone period,67,30
Cell_Phones_and_Accessories,B002D0ZN8Y,5.0,positive,super small light and great sound quality the sound quality rivals that of any ear buds i have ever used the battery seem to drain in about 3 to 35 hours but there are no bulky electronics these are literally ear buds without a dangling wire simply awesome,48,13
Cell_Phones_and_Accessories,B002D0ZN8Y,4.0,positive,this is a bluetooth headset that will not illicit looks of contempt or scorn the unit is discreet but sexy and the sound quality is excellent the noise cancelling feature is very effective and is a potential safety issue if you plan to use these outdoors there is only one controll button on the unit that will pause playback answer calls and power on / off the unit i have found the battery life to be fairly short and the microphone is incredibly sensitive so background noise can be a problem with devices that do not allow for configuring mic sensitivity simply put this is an exceptional product but it is not without it is shortcommings apple users should also note compatibility issues with the controll format of this unit if you are like me and want the bleedingof tech this is the solution,143,34
Cell_Phones_and_Accessories,B002D0ZN8Y,3.0,neutral,these sonys are lightweight and comfortable if they work with your phone or mp3 player they are unobtrusive as to be almost invisible unfortunately these do not work well with the iphone 3gs or the palm pre the iphone can not control volume which is ear-splitting loud the volume control disappears and pressing on the volume buttons does nothing the palm pre does control the volume and it works well with the phone but the music does not play too bad because they are nice and lightweight,85,55
Cell_Phones_and_Accessories,B002D0ZN8Y,4.0,positive,i love these except for the volume control the other thing is when i listen to movies on my itouch there is a short delay 1 sec syncing with the mouth saying the words,34,27
