category,prod_id,rating,polarity,review,review_len,review_id
Software,B003YJ8WFE,1.0,negative,i have been very disappointed with this product at first i could not even transfer my pc files over to it my husband did an internet search for help and finally ended up calling the company for help they walked him through a very lengthy tedious process of transferring the files i had four companies files that i wanted to two of the transfers worked two did not then when i looked at one of the companies whose transfers worked i found that none of my memorized reports had been saved it looks like i will only be able to use quickbooks on the old pc that i saved if i want to access the information because it certainly is not available to me on the mac,126,198
Software,B004DLCQZ4,1.0,negative,when youit quicken will not allow registration books and forms promised from online are not available to user,20,8
Software,B004DLCQZ4,5.0,positive,quicken willmaker premium 2011 is a very friendly product to use explanations for each section are clear updates available each state is in the select box you will have the right information for the state in which you reside,39,16
Software,B004DLCQZ4,5.0,positive,this product is excellent for the layperson it uses everyday language and includes estate planning living wills powers of attorney and many other documents you would not think of preparing for yourself or for your family members great job nolo and amazon for carrying it at such a low price i will purchase from you anytime,55,0
Software,B004DLCQZ4,2.0,negative,you must use a current version with up to date laws,11,23
Software,B004DLCQZ4,5.0,positive,i really purchased this software to review what i wanted to do and thus reducing my cost when i visit an attorney i was able to produce a living trust then visit an attorney i actually saved money by being organized the attorney actually thought what i did was a greatand policy,54,11
Software,B004DLCQZ4,5.0,positive,the willmaker had absolutely everything i needed then and will need in the future the crochet books were for a friend and she loves them the levis were for my husband they fit as they should accidentally ordered regular 501s once and they were snug in waist but he wears them anyway the shrink to fit are his levis for sure on the book have not even had a chance to start it but I am sure I shall love it,79,9
Software,B004DLCQZ4,1.0,negative,i have not had the opportunity to examine all of the software in this package deal from quicken i bought this primarily interested in the living trust maker that comes bundled in this package after successfully installing the willmaker premium 2012 software onto my vista machine i put the living trust maker disk in my pc but i did not get the welcome screen that should appear automatically therefore i followed the instructions that were given on the disk and on the nolo quicken web site when you run into this issue apparently i am not the first i wento to start accessories run and entered d autorun but nothing happened i also tried e autorun and f autorun to no avail i went to the nolo quicken support site for further assistance but found none i am just a bit frustrated i guess i will have to see if there is a quicken technical phone number that i can call for further assistance i will come back and revise this review should i have success installing the disk and after i have had the opportunity to use the software,185,13
Software,B004DLCQZ4,2.0,negative,there are very few options for anything but the simplest will or trust did not suit my needs could not return opened software to amazon but nolo maker of product gave me a full refund after i emailed them with my problem,40,1
Software,B004M39SN6,5.0,positive,this set uses both a mans voice and womans voice to pronounce words which helps you learn there are also games to make it fun great value for the price,30,19
Software,B004M39SN6,2.0,negative,some fun games and stuff you would do much better downloading a language app on your phone or even better making friends with spanish speakers the best way to learn is to immerse yourself listen to spanish music watch spanish tv and go visit and make friends with latinos they will warmly welcome you and be glad to help a gringo out,62,42
Software,B004M39SN6,1.0,negative,even after downloading a patch available on eurotalkcom the cd will not play correctly on my imac when starting the first exercise i keep receiving an error message super talk error number 13 long integer expected but found something else,40,156
Software,B004M39SN6,4.0,positive,i could not wait to recieve this i bypassed my ipod and uploaded it to my amazon cloud this way i can access it anywhere we travel to a spanish speaking country usually every year and I have found this very useful as other reviewers have said it does require that you listen and do the work i do not have any experience with rosetta stone so i can not compare it to that but i can not find any fault with instant immersion spanish,82,111
Software,B004M39SN6,1.0,negative,the speaking portion of rosetta stone is overall very good sometimes the feedback to the speaker is frustrating in that it is very picky and arbitrary however i would never use rosetta stone again unless the parent / teacher speaks and writes spanish fluently the student has no chance to learn how to correctly write or speak spanish rosetta stone does not teach grammar they hope the student will learn it through immersion immersion only teaching may work pretty good in very young children but has it is limitations as we age at the very least it would be helpful if they would provide the keys to the worksheets and tests with the answers translated in english,114,148
Software,B004M39SN6,5.0,positive,easy to use works great learning at your own pace,10,15
Software,B004M39SN6,4.0,positive,works well and came quickly i just finished my masters and should be working on my spanish with this over the summer before i go to spain,27,24
Software,B004M39SN6,4.0,positive,it gives you lots of different options to help you learn spanish with the dvds games and cd / mp3s great price,20,68
Software,B00G6CLN3Y,5.0,positive,this product works well unlike other reviewers i had no problems with installation or hangduring and a new computer windows 8 16 gig ram user interface is easy and intuitive and the results are acceptable this is not the highest end video processing software but it works well and is fantastic at this price point will outperform any software from 5 years ago at any price having played with various programs for about 15 years i am amazed at how my capability the new software has recommended,87,0
Software,B00G6CLN3Y,4.0,positive,the sheer number of options available can be overwhelming but stay tuned it gets better after a straightforward installation and some time spent updating the software you are presented with an intuitive interface there are a good number of resources for help in using it starting with a free 30-day installation support with registration the manual is a bit light and would have benefited from a competent technical writer it was not difficult to jump in and start modifying and editing clips most of it is just drag and drop cutting is easy moving samples around is also very easy there are a huge number of transitions effects and ask that will either make your movie great our very kitschy less is more all of this happens with almost instant and continuous rendering so you can get a hint at the eventual product the usual capabilities exist adding audio recording voiceovers and so on in spite of this the software is not that cumbersome on system resources importing and exporting is straightforward as well this is a solid performer that does all the basics any amateur would be satisfied with four stars,189,1
Software,B00G6CLN3Y,2.0,negative,after getting past some install issues with windows 81 i found the whole process of editing videos to be somewhat of a hassle compared to other programs I have used in the past such as windows movie maker or imovie the ui was very hard to navigate and it was just time consuming trying to figure out the simplest of features frankly i just do not have the time to learn this software and regret the time sink i spent on it,80,5
Software,B00G6CLN3Y,5.0,positive,it is good so far just testing it out to make sure it does not have any hang,18,15
Software,B00G6CLN3Y,4.0,positive,my video editing skills fall under the basic guidelines this package filled the need for some basic design concepts and was easy to use it did take a while tobut it is a large software package pros easy layout of basic features lots of options / templates for a quick start and consistent appearance great 2d and 3d rendering quick processing good interface cons snails pace install large software needs a fast processor or you lag a bit more advanced features are a little quirky to use steep learning curve if new to this program good program over all it is a nice platform and highly recommended,105,11
Software,B00G6CLN3Y,4.0,positive,good to have a 64 bit version of software i have used for years,14,14
Software,B00G6CLN3Y,1.0,negative,yes i now have two pinnacle products that i should never have purchased the other one is the studio 17 ultimate what was i thinking the product performed before par and i found it to be a pain in the neck to actually do what i wanted it to which is to help me edit photos simple right that is what i thought after the fiasco of trying to get help for the problems i had with studio 17 and being charged to get support i just gave up there are so many other programs out there that are far superior than pinnacle systems i would suggest going to your local best buy or similar store where you can speak to someone in person no charge to compare programs to your needs that is what i did after i through this in the garbage along with the studio 17 sorry pinnacle this was my last purchase with you,155,8
Software,B00G6CLN3Y,2.0,negative,found it confusing it kept adding things to the video and there no instruction on how to get rid of them i switch back to the old version of pinacle studio,31,13
Software,B01COADLXG,4.0,positive,i like this program a bunch and it has truly helped me redesign my entire first floor before i start my project this way i have no regrets when we actually start i just wish the terrain and roof lines for vaulted ceilings was not so hard to add or modify but overall great for rooms and additions and decking,59,0
Software,B01COADLXG,4.0,positive,unless you have used this sort of app before plan to put in some time viewing the tutorials and learn how to search the knowledge base when you run into a snag it is a great piece of software for creating a home design I have run into a few snags with some of the features but their resources for resolving them are quite good overall I am happy with the purchase and feel it was well worth the money just to be able to see the design in 3d,86,5
Software,B01COADLXG,1.0,negative,the software only works on newest computers so it does not work on mine there is apparently no way to return it so I am out 50 save your money and do not buy this software unless your computer is less than 6 months old,43,11
Software,B01COADLXG,5.0,positive,the reads all my old files from 3d home architect and works much better with more features,17,1
Software,B01COADLXG,4.0,positive,this program is somewhat limited but if you are trying layout a new home or look at how finishes will look then this is a good program i gave it 4 stars because it does not calculate roof lines correctly and the landscaping does not allow for contours,48,8
Software,B01COADLXG,4.0,positive,i used this to remodel a house i owned and was very impressed i had tried several other house design software programs both online and over the counter and was very disappointed with them this is the only one i could use without any difficulty at all i was great to be able to give my builder an exact drawing and layout of what i wanted without having to use an architect or sketching something up on paper then when he was done it looked exactly like it did on the computer inside and out it was almost anti-climactic the only reason i did not give it 5 stars is because you will probably find out that the standard program is a little lacking and you will need to upgrade for extra of course to a better version still it is well worth the money and a ton cheaper then hiring someone,151,16
Software,B01COADLXG,5.0,positive,i like it it has a learning curve but works well i am trying to figure out how to make the roof go over the porch but i think it is because i added the porch after i built the house still working on it,45,3
Software,B01COADLXG,5.0,positive,not the most user friendly version but it is downright cheap compared to others or even newer versions,17,13
Software,B00004Z0C8,1.0,negative,i paid a lot of money for this cd upgrade for my garmin and i still have not downloaded it after a year i took it to two expert computer shops and they can not do it i went to website downloaded countless updates and drivers and it still will not work i will never buy a garmin product again,57,4
Software,B00004Z0C8,2.0,negative,the software works fine and uploads easily the maps seem to be 10 plus years out of date since they are missing sections of state highway and local streets in the greater seattle area that have been completed for at least that long it also does not include street names for local streets only state and federal highways i noticed it does include local streets for some small villages in alaska i definately would not recommend this set for urban navigation but i do like the topigraphocal features and the shoreline markers but have not been able to determine if they are up do date,105,63
Software,B00004Z0C8,1.0,negative,not for the serious hiker this map is way off on it is accuracy want to plan a hike on your pc before hand forget it contours are 100 feet incurements very limited reference points actually had me on the wrong side of a creek no bench mark refferences use your garman gps it is a great tool but do not waste your time or money with this map stick to your usga maps,70,18
Software,B00004Z0C8,2.0,negative,i recently got an etrex summit gps and bought this software in order to download the trips i take into a printable format as well as to plan hikes before starting out on them the bottom line is that this 3 cd-rom set does not contain nearly enough information to do that i took a 4 mile hike this weekend near san francisco and downloaded it to the software it does show the track that we walked but the topographic information from this software is so coarse that you can not tell that we went up and down gaining some 500 feet in elevation since the contour lines are so far apart on the map generated furthermore the road into the park was not drawn correctly the ranger station and other services were not marked and so on in short the maps provided will not allow you to plan a hike which was the point in the first place right,155,0
Software,B00004Z0C8,4.0,positive,if you hike in areas not covered by mapsources national parks 24k then this is the only way to get topo maps into your garmin gps unit the scale is 1100000 in united states topo whereas the national parks version is 124000 so you get less detail but complete coverage one nit-pick although it is not garmins fault the 1100000 scale usgs maps are in metric so garmin converted the meter contours to feet which means that even contours like 1000 meters is shown as 3280 feet at least you do not have to deal with elevations in meters although,97,28
Software,B00004Z0C8,5.0,positive,this mapping software for my gps garmin 76csx was a great help in finding trails and roads it was close for elevation in the area thanks,26,72
Software,B00004Z0C8,5.0,positive,i love this product first copy this disk to your hard disk and then install from there then you do not have to used the cd each time youthe mapsource application also be sure to download the latest version of mapsource from garmin after you install the cd version,50,10
Software,B00004Z0C8,2.0,negative,i live in colorado and am amazed at how terrible the maps on garmins mapsource are rivers start and stop roads that have been there since the 1800s do not show up none of the trails are named it is really bad i would think that if garmin was going to force us to by their maps they would make an effort to improve them i would say that anyone with a garmin who is going to use it for 4wd roads and hiking trails should buy another mapping program to get waypoints,91,34
Software,B00005AFI4,1.0,negative,i agree poor girl i am a real newbie massage therapist turned computer user and have found this program to be a web creators nightmare i think I shall cruise on down to the freeware sites to see what i can scare up there i want a fairly simple web page that links to a few more for those of us that know the anatomy of the human body better than html i would stay away from this beast it will make the less confident feel even more so and by the way these other sugar coated reviews does microsoft pay some slouch to type them up all day or what nauseating,108,11
Software,B00005AFI4,5.0,positive,this product was very price-worthy was easy to install and has performed perfectly since i bought it it is doing exactly what i hoped and more the product itself was in excellent condition,33,9
Software,B00005AFI4,5.0,positive,i always thought that publisher 2000 was easy to use this upgrade is even easier even someone who has never used publisher before can make outstanding postcards flyers newsletters and publications what a excellent product,34,0
Software,B00005AFI4,5.0,positive,arrived quickly and in good condition with activiation code on the package i needed this to access some old files that coulldnt be opened in publisher 2010 worked great i prefer this version in a lot of ways,38,8
Software,B00005AFI4,1.0,negative,publisher 2000 was bad stupid me i thought maybe 2002 would be better not save your money and buy print shop or print master platium they work better for less money and take up less real estate on your hard drive the interface is even less intitutive that previously the most common task that even i can make word 97 accomplish will not work in publisher sorry microsoft i will not be buying this again everything the other reviewers have said times 10,81,5
Software,B00005AFI4,4.0,positive,this is a good product i have publisher 2000 and i like to added features and the new templetes realy worth the money microsoft has done it again with really great features and value,36,2
Software,B00005AFI4,4.0,positive,as much as i hate to admit that microsoft has done a good job i have to on this one the improved interface makes it so much easier to use users of old versions of publisher will be pleasantly surprised that this one is definitely worth the money for the upgrade if you have never used a desktop publishing program before check this one out you will not be disappointed i am running an entire small printing business from this program alone the only reason i have not given 5 stars is because i still want to be able to create text boxes in shapes round triangleinstead of square and rectangle,112,1
Software,B00005AFI4,1.0,negative,i was looking for a helpful upgrade and instead got perhaps the most user unfriendly software i have used in a long long time i am a software tester by profession and would have failed this product on poor usability stay with the previous version,45,12
Software,B00005NZXQ,2.0,negative,what a disappointment considering modern day programs this one is primative it reminds me of apps 15 years ago it is complicated yet limited in what it can do i have been trying for 3 hours to add a page for a digital scrapbook and once the program labels a page as front it can not be done I have clicked on everything their non interactive instructions suggest no luck even the tutorial is non-interactive additionally pages can not be rearranged once completed unless one goes through the process of copy and paste further each project is limited to 10 pages so to create a hundred page album one needs 10 projects the help section is also very basic one good feature is that the photo editor seems pretty simple to use and does a fairly decent job additionally no problem running this with windows 7 have not used any other scrapbook programs but i sure would not recommend this one,156,9
Software,B00005NZXQ,5.0,positive,to those with print quality issues it is your printer or printer preference settings there is a lot of flexibility and creative potential with this software it is also easy to use my 10-year-old who never saw it before jumped right in and is creating terrific pages can not beat it for the price,50,11
Software,B00005NZXQ,1.0,negative,i bought this product and love the results on my screen unfortunately it does not look so beautiful anymore when i print the pages out the preview and printout are fuzzy as if in draft mode all my other applications print out just fine i contacted novas technical support but the only help they offered was to send another disk which did not solve the problem now they ask me to be patient while they try to figure out my problem i have waited a few weeks now and am very disappointed no matter how great the software is if there is no real technical support it is worthless,108,0
Software,B00005NZXQ,2.0,negative,I have been trying to find a good program to scrapbook with so that i can still print out pages and not just have them on the computer this one does not print well at all I have tried printing one of thier premade pages pages I have created from scratch with and with out pics put in and everything comes out pixilized i have not had any text come out with clear edges and anytime you change the size of any graphic it will pixilize the edges i do have a good printer and can print perfect pictures so long as i do not use this program another thing i found extremely frustrating was not being able to search for a type of graphic if you want a heart or scissors or flowers you have to search through everything to find them this program would be ok if you do not want to print the pages out but if you do look for something else,162,12
Software,B00005NZXQ,5.0,positive,i almost did not buy this program because of the negative reviews but having worked in retail before i realized that people are more likely to complain than say anything posative i love this program i could go on all day about it i have so many ideas for projects and that is great because there are endless possabilities with this program you can make your project as personal as you want it to be add graphics of your own or alter their graphics to suit your mood you can add pictures and make them look antique as well as shape them into various shapes and styles add text here lighten here change colors it is fabulous as far as the pictures printing out clearly I have had no problem of course when altering your pictures if you force it into a shape that the pixels can not accomadate certainly there would be some problems digital pictures work best but my scanned ones have done well too just have fun and play with it i would reccomend this program to anyone interested in a unique and fun way to save their memories,187,5
Software,B00005NZXQ,1.0,negative,this edition of scrapbook factory is not nearly as good as scrapbook factory deluxe 4 i have played with all four editions and they got it right with the fourth one three is close and as far back as i am willing to go although you can not extract images which is one of my favorite ways to create pages in four you can create jpegs as well as pdfs of your pages and the whole program itself is more intuitive it took me all of a half hour before i had my first page done showing people the ropes of the software i gave version four as a christmas gift to a few people took all of ten minutes before they were on their way to making beautiful pages of their own you can get a copy of four for about 2000 more than this version and i feel it it well worth it many pages i have done people think were done with 40000 photoshop do not waste your time with this software evolves over time and generally becomes more powerful and user friendly as it evolves,187,8
Software,B00005NZXQ,4.0,positive,this is pretty easy to use and I am having fun with it i can not compare it with any other scrapbook programs since this is the only one I have used but from what i see this is really all i need,40,2
Software,B00005NZXQ,4.0,positive,this software gives great guidlines for begginer scrapbookers,8,1
Software,B0002IP3KM,2.0,negative,i travel on the road all the time and i use my gps and laptop to find my way around i would have to say that the software that comes with the garmin gps is a hundred times more accurate and useful i have found that many of the roads in street atlas were labeled wrong or just plain drawn wrong there is a lot of old information and not updated regularly i live in a neighborhood that was built almost ten years ago and in street atlas 2004 it still did not have my neighborhood in it and i live near a major city i can not recommend this software for other than very basic information you can get a paper map that will work better,125,0
Software,B0002IP3KM,4.0,positive,i purchased street atlas 2005 as i was so satisfied with aaa mapngo from delorme the mapping program is absolutely great it is operation is really quite simply and anyone can work it it is much better than microsoft streets which i had the 2002 version the only fault is that their data base is too old and does not seem to have a lot of the development in the last 2 or 3 years of motelsstations and resturants,79,17
