category,prod_id,rating,polarity,review,review_len,review_id
All_Beauty,B005U5KU46,1.0,negative,these shields were too flimsy did not sick and bunched up will not purchase again,15,8
All_Beauty,B005U5KU46,5.0,positive,great product i used these for a series of interviews that i would not have time to have my suit cleaned between every interview they worked perfect to keep odors off of the jackets i used,35,13
All_Beauty,B005U5KU46,4.0,positive,the shields are made to be more flexible so stayed on all day on my jacket i had a sleeveless top under so they protected my jacket well just be mindful when you take the jacket off / put it on i will continue to use these much improved from older versions that would come off,56,9
All_Beauty,B005U5KU46,4.0,positive,they did the job but part of the pads were sticking to my skin which bothered me at first then it was okay,23,21
All_Beauty,B005U5KU46,5.0,positive,these are very thin pull off easily without residue rare the only odd thing about these is that on the crease it actually had cut out slits along it so technically a person could sweat through those slit openings on the crease of their jacket / shirts,45,0
All_Beauty,B005U5KU46,2.0,negative,very hard to position not worth the hassle,8,11
All_Beauty,B005U5KU46,4.0,positive,i can see how these may not be the best for a shirt however they have saved me on dry-cleaning for my work blazers a nice blazer or jacket is expensive and it is awesome to get a few wears out of each during either a big client meeting or a hot spring / summer day these will be stocking stuffers over the holidays for sure,63,16
All_Beauty,B005U5KU46,2.0,negative,these are good in theory but they do not stick to my clothing,12,17
All_Beauty,B006H8X3JO,4.0,positive,i recieved my machine today it arived on time and had everything in it it all works great but the coil looked burnt when i got it but after cleaning it it all worked fantastic awsome for beginer artist it could use a book of how to set up,49,9
All_Beauty,B006H8X3JO,5.0,positive,the kit came 1 day late but it is cool laughing out loud the grip is not the one they show it is straight n ink caps white no biggie thanks you,30,11
All_Beauty,B006H8X3JO,5.0,positive,i was very impressed i plan on ordering from them for all my tattoo supplies,15,0
All_Beauty,B006H8X3JO,5.0,positive,i like dragon hawk products because your tattoo kits have a great price for people like me that is starting out tattooing and i check out others brands of tattoo kits but no one had a better deals but dragon hawk is the place to start if you love tattooing and want good deals of tattoo kits ps wow your kits only have a big black ink bottle that will last me awhile and saves me money thanks and you got a costumer for life,86,13
All_Beauty,B006H8X3JO,5.0,positive,it is doing good so far i highly prefer to have my own kit because of prices of tattoos i love this,23,5
All_Beauty,B006H8X3JO,4.0,positive,it is a good starter kit but over heats with bigger tattoos power box shorted out but they mailed me a nee one with no problems very nice people i would recomend this kit,34,8
All_Beauty,B006H8X3JO,1.0,negative,when i got this it had a few problems including screws being stripped and i was not able to use it,21,2
All_Beauty,B006H8X3JO,4.0,positive,i really like my gun run 2 tattoos it is smooth will order another one,15,1
All_Beauty,B00H4EEK1K,1.0,negative,this cover does not fit the trio stealth the corner pieces do not stay in place and are not large enough to hold the tablet the case does not stay in the upright position when trying to stand it up very disappointed,42,36
All_Beauty,B00H4EEK1K,5.0,positive,i love this case it is everything I have been looking for and great protection for my tablet i was worried about the corner tabs not holding my tablet securely they hold great way better than i could ever imagine thank you,40,16
All_Beauty,B00H4EEK1K,2.0,negative,elastic clips were inconsistent on both pieces we purchased the inconsistencies allowed the tablet to not only slide back and forth but would slide right out the side and ultimately would hit the floor as although it had no case at all,42,4
All_Beauty,B00H4EEK1K,5.0,positive,these are great cases i bought them for the tablets that my grandkids got for christmas if they can not wreck them no can,23,9
All_Beauty,B00H4EEK1K,1.0,negative,i was totally disappointed one of the straps pulled out within two days i would have sent it back but i had already thrown the bag away and box with all the christmas paper definitely would not recommend this to anyone,41,45
All_Beauty,B00H4EEK1K,1.0,negative,the tablet keeps popping ouy of the little brackets not good quality at all having to buy a new case drom a different company,24,40
All_Beauty,B00H4EEK1K,5.0,positive,i really like this tablet case it fits the trio stealth-10 perfectly the claws hold the tablet very snugly to the case there is no room for play that would allow it to fall out theis very vibrant and i love the black elastic band that holds the case tightly closed and the bonus stylus fits perfectly in the ear plug outlet so it will always be available,70,61
All_Beauty,B00H4EEK1K,1.0,negative,does not work it is just another universal case just as someone else said you have to remove it from case to use camera,23,5
All_Beauty,B00ITNNI4K,4.0,positive,i liked it a lot it looks really nice on a hand and it does not look cheap the only thing that was bad few of the little rings in the chain were not closed properly so i had to fix it with pliers so that it would not fall apart,50,0
All_Beauty,B00ITNNI4K,5.0,positive,kinda big i have small wrists very cute although,9,17
All_Beauty,B00ITNNI4K,5.0,positive,thiswas well worth what i paid for it it was good quality for the price and i received it very quickly,23,15
All_Beauty,B00ITNNI4K,4.0,positive,it is okay and i like it however it is cheaply made,11,1
All_Beauty,B00ITNNI4K,4.0,positive,product as expected but although stated it would be slow was even longer than expected as other items ordered from over seas on the same day can a week sooner,30,8
All_Beauty,B00ITNNI4K,1.0,negative,very I shall fitting ring too small bracelet too big,9,5
All_Beauty,B00ITNNI4K,1.0,negative,got thistoday and it was already broken,9,11
All_Beauty,B00ITNNI4K,2.0,negative,i bought another one of these in silver and they both lose theirafter wear for about 20 minutes in hot weather I am never buying these again,28,3
All_Beauty,B00NLNO554,4.0,positive,time will tell whether the caps fall off but so far so good the pens write well no skipping they do not feel cheap in the hand the little o-ring on top of each cap is small but i did not have a problem fitting it onto a small flashlights o-ring after i removed the chain the chain itself is not sturdy to the eye or feel essentially useless i would not trust it to hold otherwise I am pleased,76,36
All_Beauty,B00NLNO554,1.0,negative,I have had these pens for less than a month and I am on the third one as the pens have fallen out of the caps i have the pen attached to my work badge i work in an office setting so there has not a lot to grab / catch on the pens but they continue to fall out I have been walking across the office and had coworkers stop me because my pen is laying on the ground some feet back i would not buy these again nor suggest that others buy them either,90,16
All_Beauty,B00NLNO554,2.0,negative,i need a pen attached to my keychain at work at all times i have always used the mini rsvp pens from pentel most stores in my area are not carrying them so i found these sorry but i hate them they are very small for writing and since i attach them to my keychain the round plastic hole for the chain to go through broke in one day my other pens never broke thicker plastic if you just need a tiny pen and not using it for hanging it would be ok i will not buy these again since i have found the pentel pens i want on amazon oh and the chain they come on is a joke totally worthless,120,4
All_Beauty,B00NLNO554,5.0,positive,these come in handy when you do not have a pen ready just put it on your key chain and you will always have a pen handy amazinglove it I have given away 6 already close friends and others i tell them where to buy them keep up the good work with fantastic ideas,53,9
All_Beauty,B00NLNO554,1.0,negative,i wanted these pens to keep on my work badge / key ring so i would always have a pen handy but the pen constantly falls out of the cap so i lost 3 pens within a few weeks before i gave up they would be better if the cap stayed on and if they had colored ink to match theof the case,63,45
All_Beauty,B00NLNO554,4.0,positive,do some geocaching they are not the best quality but they are great to leave in a larger geocach container for other cachers to document their find,27,40
All_Beauty,B00NLNO554,4.0,positive,these pens are perfect for attaching to a lanyard so you always have a pen with you the chains are reasonably strong I have only had one fall off and that was when it got scrunched in a corner the pens are moderately tight in the cap they do not fall out with normal use but you need to be careful if you put them in your pocket or otherwise create a situation where the pen can be friction locked allowing it to be pulled loose of the cap the pens are a little on the small side but manageable for quick tasks such as writing a signature or jotting down a note there is no way you would want to use it all day unless you have small hands,128,61
All_Beauty,B00NLNO554,4.0,positive,I shall have to agree with the reviewer that said the pen cap pulls off too easily if used in a keychain fashion as described and intended however i was looking for a very small pen to keep in my pocket and it works very well for that i unscrew the little keychain attachment and the lid stays on in my pocket so I am always ready to write in a notebook i carry i frequently have a better pen but not always this one fits your hand pretty well if you remove the cap and place it at the but of the pen otherwise it is a little too stubby the product could certainly be improved by making the cap fit a little tighter but it works well for what i wanted,130,5
All_Beauty,B00NV6A3P2,4.0,positive,they hurt a tiny bit but i love how they look,11,53
All_Beauty,B00NV6A3P2,1.0,negative,do not buy came all broken and in tarnish silver not colored,11,60
All_Beauty,B00NV6A3P2,5.0,positive,i love these i got them to make my parents crazy and it worked,14,0
All_Beauty,B00NV6A3P2,4.0,positive,i bought some of these and they do not hurt and they did not put a hole on you no matter where you put them i wore them all day long on my lip because that is where the original piercing is and ther was no hole left by these fake ones the reason i wore this was because i was taking a break from my real piercings i was quite comfortable with these and i will buy them again,78,45
All_Beauty,B00NV6A3P2,1.0,negative,just do not buy it it does not look real it looks so fake and you do not even get different colors they are all silver and break at the slightest touch,29,5
All_Beauty,B00NV6A3P2,4.0,positive,i recieved 6 but they came in pairs of three colors pink red and silver it was not a problem however i wanted silver ones and the price of this was great so the extra pink and red rings were like an extra they came in a small package the delivery was fast and overall i consider this to be a good purchase,62,61
All_Beauty,B00NV6A3P2,5.0,positive,i really like them and use them a lot i got 2 gold 1 red 1 purple and 1 pink i was hoping for on to be black but it was fine would recommend does not leave a mark but can tend to hurt for a while if you leave on for a pretty long time,55,16
All_Beauty,B00NV6A3P2,5.0,positive,this was an amazing buy it came in fast and nothing was broken or missing i received three gold one red and one purple i wore it around town and i had to go to walmart and my friend saw me and asked if it was real i did not want to lie so i said no it is a fake and she said it looks good on you i was quite surprised someone actually thought it was real i love it I am going to buy more and hope for more colors,90,12
All_Beauty,B010DER7HG,4.0,positive,sponges are very soft perfect for blending they do expand when wet just a bit cleaner works great too,19,0
All_Beauty,B010DER7HG,5.0,positive,great product for a great price easy to clean and good product,12,1
All_Beauty,B010DER7HG,1.0,negative,not worth a penny sponges broke off handles within days do not waste your money,14,5
All_Beauty,B010DER7HG,1.0,negative,brushes are poorly made and fell apart after only using it twice,12,15
All_Beauty,B010DER7HG,1.0,negative,cheap handle came out of all of them,8,11
All_Beauty,B010DER7HG,4.0,positive,it feel a little to harsh for my face,9,14
All_Beauty,B010DER7HG,2.0,negative,only one of these sponges i was satisfied with and that was the teardrop the other two seemed a bit flimsy when i used the cleaningthat came with the sponges it tore through the sponges so i am no longer able to use them not very satisfied with this product wish it was of better quality,58,8
All_Beauty,B010DER7HG,5.0,positive,these are inexpensive and very useful they were smaller than i expected but you have to remember that they are essentially a brush style sponge applicator blendor they get the job done and i love them,36,13
All_Beauty,B011773O2U,1.0,negative,i bought two of these the red one is completly unusable it is so clumpy does not go on smooth the taste of this product is gross i would not buy again,31,30
All_Beauty,B011773O2U,4.0,positive,nice i really like it but unfortunately it is a bit messy when applying but other than that it is great,21,0
All_Beauty,B011773O2U,1.0,negative,shipping took like a month and it does not work good it does not stay that long it taste nasty you are better off buying a lipstain,25,22
All_Beauty,B011773O2U,5.0,positive,owmygee my liptint arrived this morning and it is so nice it look so good on my lips so happy for this product surely going to get another one,27,31
All_Beauty,B011773O2U,2.0,negative,very hard to apply very hard to wait 20 minutes for the tint to dry the tint also did not actually peel off but i had to rub it and finally rub a damp towel over my lips to get off all the pieces thewas lighter than i expected and it was not long lasting,57,18
All_Beauty,B011773O2U,2.0,negative,eh there are much better brands this is loaded with chemicals and i can not help but feel like i am doing my body a disservice it takes a lot of time and patience to get on evenly and just is not worth it,42,28
All_Beauty,B011773O2U,2.0,negative,the top almost popped off at first use the applicator part had a rough piece of plastic so could not smooth it onto my lips super funny texture and unfortunately left a weirdi really wanted to like it but it was horrible on all accounts,46,10
All_Beauty,B011773O2U,4.0,positive,highly recommended it is not irritating and some ingredients are natural like rose hips oil aloe natural fruit essence and also with vitamin e i have very sensitive lips so i choose the lipstick that i am using jeny,39,53
All_Beauty,B0166R22CO,1.0,negative,very clumpy and goopy did not go on smoothly only used once,12,27
All_Beauty,B0166R22CO,2.0,negative,i do not know why essie comes up in the luxury category I have never liked this polish the colors are mostly bland it chips quickly really this stuff is overpriced it is not terrible but it is not high quality either,38,15
All_Beauty,B0166R22CO,4.0,positive,greati really like it the only bad thing about glitter polish is the removal i hate it,19,23
All_Beauty,B0166R22CO,1.0,negative,chipped within 3 hours of a professional manicure would not recommend i am not a fan of essie nail polish especially after buying this,24,17
All_Beauty,B0166R22CO,2.0,negative,well it is a prettybut that is about it chipped of the first day and the gel formula was very difficult to work with,24,8
All_Beauty,B0166R22CO,5.0,positive,theis amazing i just love it so glad it came back,13,9
All_Beauty,B0166R22CO,1.0,negative,not what i was expecting at all usually essie colors are true tothis is one exception once applied theis iridescent with a lot of yellow greens tones and even with three coats it is still translucent i have a few other colors from this retro revival line and love them but this one is not worth the almost 900 i paid,65,28
All_Beauty,B0166R22CO,5.0,positive,they were given as gifts they loved them,8,24
All_Beauty,B016KGPK1Q,1.0,negative,either i received the wrongor they are knowingly sending out something completely different i received 3 gold pins with cheap white beads on them no flowers or leaves at all and the beads do not even look like the little ones in the picture either so I am getting a refund for this disappointment,54,0
All_Beauty,B016KGPK1Q,1.0,negative,when i ordered these the description said silver the ones i got were gold they have since changed the description still i was not happy,25,1
All_Beauty,B016KGPK1Q,4.0,positive,I am actually pretty happy with these they are a very yellow gold which is the only thing I am not super thrilled with since the photos look more subdued and brassy but overall it is not a huge issue they still look so pretty i used them for my bridal portraits and they held up very well i plan to use them for my wedding now as well i do wish that the silver ones in the last photo were available to purchase as well but i could not find them anywhere,89,5
All_Beauty,B016KGPK1Q,1.0,negative,the gold reminded me of willy wonka gold,8,14
All_Beauty,B016KGPK1Q,5.0,positive,the goldis very gold almost cartoonish gold but i have dark hair and the accentfor my wedding is gold so it will work out fine but it was a bit of a shock when i first saw it quality product,43,13
All_Beauty,B016KGPK1Q,2.0,negative,the gold is very cheap looking i wanted these for my wedding but they look bad,16,11
All_Beauty,B016KGPK1Q,5.0,positive,these hair pins were absolutely perfect for my wedding day during my trial my make-up artist recommended getting hair pins to bring out and add a little bit more texture to my hairstyle i bought these the week before my wedding and they ended up looking great with my up-do and against my dark hair we decided to just use 2 in my hair since having all three seemed to be a little excessive these hair pins were so inexpensive in comparison to other bridal hair pins and totally worth the cost i definitely recommend these for a bride on her big day,103,8
All_Beauty,B016KGPK1Q,1.0,negative,the metal had a cheap look to it did not end up wearing it,13,9
All_Beauty,B017BJ877K,4.0,positive,all the rings are different sized and some fit some do not,11,9
All_Beauty,B017BJ877K,2.0,negative,love these little rings but you get what you pay for all the open / adjustable rings break within the first two wears the solid bands are a bit stronger realize these are a trendy short term accessory,36,25
All_Beauty,B017BJ877K,1.0,negative,they were broken before i got the chance to open the bag,12,8
All_Beauty,B017BJ877K,1.0,negative,these rings are a cute design but the quality is that of a quarter prize machine at a grocery store save your money and wrap tinfoil around your fingers,29,21
All_Beauty,B017BJ877K,5.0,positive,so cute i love them and so cheap good for bohemian look,13,0
All_Beauty,B017BJ877K,5.0,positive,came in as pictures the material is not flimsy cute rings,10,12
All_Beauty,B017BJ877K,4.0,positive,only one of them broke and i did not like that one anyway laughing out loud they are surprisingly sturdy for what you are paying they are all different sizes after a while thestarts to get a little coppery these rings are pretty good for the price,43,17
All_Beauty,B017BJ877K,2.0,negative,these rings are very cheap the metal is almost plastic-like the designs are cute but the metal had flakes leftover from when they were stamped only three of the six were sanded leaving sharp burs on the other three i am dissapointed but contented with the few rings of the set i can wear i would still buy from this seller as their service is wonderful and everything else I have bought from them has been excellent,76,22
All_Beauty,B018AVVYAK,4.0,positive,easy to use and i get great results which is important to me since i have very coarse frizzy kinky unmanageable hair,22,24
All_Beauty,B018AVVYAK,4.0,positive,tangles hair too much other than that great product,9,13
All_Beauty,B018AVVYAK,2.0,negative,heavy and awkward to use you almost can not use without hitting the buttons and changing the heat settings it does make a little difference but not enough to really notice the bristles will scratch your neck if not careful would not buy again,43,8
All_Beauty,B018AVVYAK,2.0,negative,it was a gift for our daughter she tried it but it did not work on her hair it left it as frizzy as it was before she started,28,25
All_Beauty,B018AVVYAK,1.0,negative,horrible did not work and burnt my hair do not bother,9,4
All_Beauty,B018AVVYAK,1.0,negative,gave as a gift did not get hot enough,8,40
All_Beauty,B018AVVYAK,4.0,positive,great for straightening your hair i use a comb just to get tangles out prior to the use but like it better then a flat iron,26,19
All_Beauty,B018AVVYAK,2.0,negative,it broke one week later when my aunt used it it is basically a blowdryer,14,39
All_Beauty,B01AMSFNBK,4.0,positive,this mirror works great the light is not too bright,10,29
All_Beauty,B01AMSFNBK,2.0,negative,the mirror is just fine however the perimeter light is so soft or low that it is pointless do not buy this product for the light feature you will be disappointed,28,15
All_Beauty,B01AMSFNBK,1.0,negative,impossible to open the mirror to install the batteries i guess i have to return it worthless,17,24
All_Beauty,B01AMSFNBK,5.0,positive,got this for my 92 year old dad so he can see better to shave works well and arrived on time,21,17
All_Beauty,B01AMSFNBK,1.0,negative,wall extension seems flimsy but i never got far enough to find out the battery case extremely difficult to twist open once it is the edges of the open case are sharp yep it cut me returned for refund,39,8
All_Beauty,B01AMSFNBK,2.0,negative,the mirror was easy to install and works fine but the reason we bought it was the lighting the leds are very dim and almost useless,26,9
All_Beauty,B01AMSFNBK,1.0,negative,this has never worked the switch is bad and it will occasionally flicker but will not stay on,18,30
All_Beauty,B01AMSFNBK,4.0,positive,works for our small bathroom not as bright as i hoped,11,25
All_Beauty,B01BEX4GU6,1.0,negative,this wig was horrible it was actually missing some hair in places thanks for doing a cancer patient wrong,19,27
All_Beauty,B01BEX4GU6,4.0,positive,actually for the price it was a surprisingly nice wig just not a style i could wear very different than what was pictured,23,15
All_Beauty,B01BEX4GU6,1.0,negative,it came brown not blonde like it stated and does not even resemble the picture i hate it i wanted blonde,20,23
All_Beauty,B01BEX4GU6,2.0,negative,be aware you need to style it it does not look like that when it comes,15,17
All_Beauty,B01BEX4GU6,1.0,negative,way too dark for my complexion it is light brown not blonde at all i guess it is the lighting in the studio that makes it appear thus i had to return it,32,8
All_Beauty,B01BEX4GU6,1.0,negative,no stars looks nothing like the picture do not buy this there are not even any form of bangs and it is more than fluffy,22,9
All_Beauty,B01BEX4GU6,4.0,positive,for the money great wig just needed trimmed up a little andis perfect the company is also great for customer service recommend,24,28
All_Beauty,B01BEX4GU6,1.0,negative,the wig looked nothing like the picture and you could see the scalp part where the hair is weaved into it just looked cheaply made,25,24
All_Beauty,B00J2AJ3U2,4.0,positive,i use this on my sun damage brown spots on my face which are very hard to see now trying it on my hands next will be needing more,29,0
All_Beauty,B00J2AJ3U2,4.0,positive,i have been using this product for 6 weeks now have seen a big improvement i use it for sunspots on my hand and have seen a significant change and I am excited to see more change while continuing using this product i would recommend this product for lightening sunspots,49,5
All_Beauty,B00J2AJ3U2,4.0,positive,disclaimer i received this product for review opinions expressed are completely my own I have been using this skin lightening cream for over a week now and i must say i really like it is hydrating ability i have a couple dark spots from newer breakouts and uneven skin and although i have not seen much change in them since using the product i feel that with future use i will see more results the cream itself is white inand is a little thick it has a light kind of tropical scent i find it very energizing and gets me more awake in the morning due to the smell the cream leaves a not too heavy feeling on the face it is very moisturizing the moisture lasts throughout the day i like also that the product is natural with no parabens or sulfates the bottle is bigger than most creams that i have seen which is nice and i am excited to use the product and see future results overall i think this is a good moisturizing cream that has a great energizing scent and provides long lasting hydration,189,11
All_Beauty,B00J2AJ3U2,1.0,negative,did not work for me i finished 1 bottle and say no difference,13,1
All_Beauty,B00J2AJ3U2,4.0,positive,this product works every bit as good as the beverly hills md product at half the price,17,8
All_Beauty,B00J2AJ3U2,5.0,positive,my efforts at getting a tan with liquid bronzers was not successful i looked closely at my skin and realized that my face looked really patchy i was so pleased to find a lightening cream on amazon and i restored my complection many thanks,43,16
